,origin,Common Name,scientific_name,Max_Growth,Poisonous_for_pets,big_image_url,temperature,max_plant_price,min_plant_price,average_plant_price,origin_country_list
91,Western Africa,Mother in law's tongue and snake plant, Sansevieria trifasciata,Height 30 in (70 cm).,Toxic to cats and dogs.,https://www.houseplantsexpert.com/image-files/mother-in-laws-tongue-plant.jpg,Average warmth is fine of approximately 60-75F (15-24C) and no lower than 50F (10C).,33.95,10.95,22.3,"Benin, Burkina Faso, Cape Verde, Ivory Coast, Gambia, Ghana, Guinea, Guinea-Bissau, Liberia, Mali, Mauritania, Niger, Nigeria, Saint Helena, Senegal, Sierra Leone, Togo"
92,Mexico,Orchid Cactus, Disocactus Ackermannii,"4 feet wide, if not pruned.",Not known.,https://www.houseplantsexpert.com/image-files/Disocactus-Ackermannii.jpg,"Keep this cactus between 60-75ºF (16-24ºC) during its active cycle.
During the resting period, daytime temperatures must be 60-65ºF (16-18ºC) and night-time temperatures must be 40-55ºF (4-12ºC).",35.0,6.99,15.87,Mexico
93,Madagascar,Panda plant or pussy ears, Kalanchoe tomentosa,Height 1.5 ft. ,Toxic to cats and dogs.,https://www.houseplantsexpert.com/image-files/panda_plant.jpg,Temperatures between 60-75 ºF (15-23 ºC) are advised.,17.94,3.58,10.3,Madagascar
94,South America,Parallel peperomia, Peperomia puteolata,45cm or longer trailing stems.,Non-toxic to cats and dogs.,https://www.houseplantsexpert.com/assets/images/peperomia_puteolata.jpg,"Ideal temperatures of 65-75ºF (18-24ºC), and no lower than 50ºF (10ºC). Avoid sudden temperature drops and cold drafts.",15.0,4.95,9.89,"Argentina, Bolivia, Bouvet Island, Brazil, Chile, Colombia, Ecuador, Falkland Islands (Malvinas), French Guiana, Guyana, Paraguay, Peru, South Georgia and the South Sandwich Islands, Suriname, Uruguay, Venezuela"
95,South America,Peruvian apple, Cereus peruvianus,Stems can grow up to 30ft (in the wild - outdoors) and more than 3ft indoors.,Not known.,https://www.houseplantsexpert.com/image-files/peruvian-apple-cactus-close-up.jpg,"Temperatures averaging 60F/15.5C - 75F/23.8C is ideal from spring to fall and a cooler 50F/10C – 55F/13, after this period. ",145.0,10.0,53.59,"Argentina, Bolivia, Bouvet Island, Brazil, Chile, Colombia, Ecuador, Falkland Islands (Malvinas), French Guiana, Guyana, Paraguay, Peru, South Georgia and the South Sandwich Islands, Suriname, Uruguay, Venezuela"
96,South America,"Pincusion Peperomia, Bean Plant", Peperomia ferreyrae,15 - 20 cm tall - 10 - 25 cm spread.,Non-toxic to cats and dogs.,https://www.houseplantsexpert.com/assets/images/peperomia_ferreyrae.jpg,"Ideal temperatures of 65-75ºF (18-24ºC), and no lower than 50ºF (10ºC).",17.99,3.5,10.43,"Argentina, Bolivia, Bouvet Island, Brazil, Chile, Colombia, Ecuador, Falkland Islands (Malvinas), French Guiana, Guyana, Paraguay, Peru, South Georgia and the South Sandwich Islands, Suriname, Uruguay, Venezuela"
97,Mexico,Rat's Tail, Aporocactus Flagelliformis or Disocactus flagelliformis,Stems can grow a few feet long.,Not known.,https://www.houseplantsexpert.com/image-files/rats-tail-cactus-flowering.jpg,Temperatures averaging 50F/10C - 75F/23.8C are ideal but not below 40F/5C and avoid frost.,NaN,NaN,NaN,Mexico
98,Southern Africa,Tiger Jaws, Faucaria Tigrina,Diameter 8in - 20cm approx. Leaves 6in - 15 long.,Not known.,https://www.houseplantsexpert.com/assets/images/faucaria_tigrina.jpg,Temperatures averaging 70F/21C - 90F/32C are very good and not below 50F/10C. ,14.99,3.58,6.55,"Botswana, Eswatini, Lesotho, Namibia, South Africa"
99,South America,"Trailing jade, round leaf Peperomia", Peperomia rotundifolia,25 - 30 cm or longer trailing stems.,Non-toxic to cats and dogs.,https://www.houseplantsexpert.com/assets/images/trailing_jade_peperomia_rotundifolia.jpg,"Ideal temperatures of 65-75ºF (18-24ºC), and no lower than 50ºF (10ºC).",19.99,7.99,12.06,"Argentina, Bolivia, Bouvet Island, Brazil, Chile, Colombia, Ecuador, Falkland Islands (Malvinas), French Guiana, Guyana, Paraguay, Peru, South Georgia and the South Sandwich Islands, Suriname, Uruguay, Venezuela"
100,Africa,Truncate living stone, Lithops pseudotruncatella,Height 1cm - 5cm max.,"Not known, but it's unlikely a pet will chew on this type of foliage, although they could be curious.","
           https://www.houseplantsexpert.com/assets/images/lithops_pseudotruncatella.jpg","The Lithop Pseudotruncatella is a plant that is suitable for a wide range of temperatures ranging from 50F to 100F. However, to ensure that the plant receives a stable and consistent temperature it is best to position it in temperatures of around 65F - 75F where it will thrive.
",14.99,2.54,7.2,"Algeria, Angola, Benin, Botswana, British Indian Ocean Territory, Burkina Faso, Burundi, Cape Verde, Cameroon, Central African Republic, Chad, Comoros, Congo, Ivory Coast, Democratic Republic of the Congo, Djibouti, Egypt, Equatorial Guinea, Eritrea, Eswatini, Ethiopia, French Southern Territories, Gabon, Gambia, Ghana, Guinea, Guinea-Bissau, Kenya, Lesotho, Liberia, Libya, Madagascar, Malawi, Mali, Mauritania, Mauritius, Mayotte, Morocco, Mozambique, Namibia, Niger, Nigeria, Réunion, Rwanda, Saint Helena, Sao Tome and Principe, Senegal, Seychelles, Sierra Leone, Somalia, South Africa, South Sudan, Sudan, Togo, Tunisia, Uganda, United Republic of Tanzania, Western Sahara, Zambia, Zimbabwe"
101,Southern Africa,Zebra Haworthia or Zebra Cactus, Haworthia Fasciata and Attenuata,Leaves grow from 4in - 8in tall and the rosette up to about 5in in diameter. ,Non-toxic to cats and dogs.,https://www.houseplantsexpert.com/assets/images/haworthia_attenuata.jpg,65F/18C - 80F/26C temperatures are very good and not much below 50F/10C. ,22.0,3.58,12.85,"Botswana, Eswatini, Lesotho, Namibia, South Africa"