,origin,Common Name,scientific_name,Max_Growth,Poisonous_for_pets,big_image_url,temperature,max_plant_price,min_plant_price,average_plant_price,origin_country_list
43,"India, Sri Lanka, Malaysia, Oceania","Croton, Joseph's coat","  Codiaeum variegatum, [syn] Croton variegatum",Height 3 ft.,Toxic to cats and dogs.,https://www.houseplantsexpert.com/image-files/Codiaeum_Variegatum.png,"Temperatures between 65-80ºF (18-27ºC) are ideal, and no lower than 60ºF (15ºC). Avoid cold drafts from near windows and doors.",174.99,6.95,61.48,"India, Sri Lanka, Malaysia, American Samoa, Australia, Christmas Island, Cocos (Keeling) Islands, Cook Islands, Fiji, French Polynesia, Guam, Heard Island and McDonald Islands, Kiribati, Marshall Islands, Federated States of Micronesia, Nauru, New Caledonia, New Zealand, Niue, Norfolk Island, Northern Mariana Islands, Palau, Papua New Guinea, Pitcairn Islands, Samoa, Solomon Islands, Tokelau, Tonga, Tuvalu, United States Minor Outlying Islands, Vanuatu, Wallis and Futuna"
44,Caribbean,Dumb cane,  Dieffenbachia Amoena,Height 6ft.,Seriously toxic to cats and dogs.,https://www.houseplantsexpert.com/image-files/dumb_cane_plant.jpg,"Dieffenbachia amoena grows best when the temperature it is exposed to is between 65-75 ºF (18-23 ºC). Outside of this temperature zone, growth will continue at a greatly reduced rate, with tolerance extremes ranging from 40-90 ºF (4-35 ºC) Beyond these extremes, the plant will stop growing and may die with prolonged exposure.",74.99,6.0,31.02,"Anguilla, Antigua and Barbuda, Aruba, The Bahamas, Barbados, Bonaire, British Virgin Islands, Cayman Islands, Cuba, Curaçao, Dominica, Dominican Republic, Grenada, Guadeloupe, Haiti, Jamaica, Martinique, Montserrat, Puerto Rico, Saint Barthélemy, Saint Kitts and Nevis, Saint Lucia, Saint Martin, Saint Vincent and the Grenadines, Sint Maarten (Dutch part), Trinidad and Tobago, Turks and Caicos Islands, United States Virgin Islands"
45,South-eastern Asia,Elephant's ear - Alocasia polly - African mask, Alocasia Amazonica,Height 1 - 2 ft .,Toxic for cats and dogs.,https://www.houseplantsexpert.com/image-files/elephants_ear_plant.jpg,Told you that you was going to need to keep this plant warm. Ideal temperatures should be approximately 65-75ºF + (18-24ºC +)...closer to 70ºF is best.,67.85,14.99,30.41,"Brunei, Cambodia, Indonesia, Laos, Malaysia, Myanmar, Philippines, Singapore, Thailand, East Timor, Vietnam"
46,Southern Europe,"European fan, Mediterranean dwarf palm, and Dwarf fan palm", Chamaerops humilis,"4ft tall and 3ft spread, small tree (much more outdoors).",Not known.,https://www.houseplantsexpert.com/image-files/european-fan.jpg,Average room temperatures are fine. This a cold hardy palm and will not have a problem in temperatures as low as 40ºF (4ºC).,68.0,8.53,18.8,"Albania, Andorra, Bosnia and Herzegovina, Croatia, Gibraltar, Greece, Holy See, Italy, Malta, Montenegro, Macedonia, Portugal, San Marino, Republic of Serbia, Slovenia, Spain"
47,Western Africa,Fiddle leaf fig tree,"  Ficus lyrata, [syn] Ficus pandurata",Height 10ft (3m). ,"Toxic to cats, dogs and horses.",https://www.houseplantsexpert.com/image-files/ficus_lyrata2.png,Temperature:Temperatures between 60 - 75F (15 - 24C are suitable. Avoid lower than 55F (12C).,290.0,23.96,67.23,"Benin, Burkina Faso, Cape Verde, Ivory Coast, Gambia, Ghana, Guinea, Guinea-Bissau, Liberia, Mali, Mauritania, Niger, Nigeria, Saint Helena, Senegal, Sierra Leone, Togo"
48,"Australia, Indonesia, China, Japan, India",Golden pothos or Devils ivy,  Epipremnum aureum,Height 6ft. ,"Toxic to cats, dogs and horses.",https://www.houseplantsexpert.com/image-files/golden_pothos1.jpg,"To keep this plant as healthy as possible, keep it at temperatures between 60-85 ºF (15-29 ºC) year round. It will withstand occasional cold snaps down to 50 ºF (10 ºC), but below this, the plant will die.",28.95,7.99,15.99,"Australia, Indonesia, China, Japan, India"
49,South-eastern Asia,"Green Velvet Alocasia, Alocasia Frydek", Alocasia Micholitziana 'Frydek',Height 2 - 3ft .,Toxic for cats and dogs.,https://www.houseplantsexpert.com/assets/images/alocasia_micholitziana_frydek1.jpg,The best temperature for this plant is approximately 65-75ºF + (18-24ºC +) or more.,44.76,14.99,25.07,"Brunei, Cambodia, Indonesia, Laos, Malaysia, Myanmar, Philippines, Singapore, Thailand, East Timor, Vietnam"
50,"South-eastern Asia, Oceania","Hawaiian ti, good luck, baby doll ti and others","  Cordyline fruticosa , [syn] C terminalis",Height 3 - 4ft indoors. ,Toxic to cats and dogs.,https://www.houseplantsexpert.com/image-files/green_leafed_cordiline_fruticosa1.jpg,"Temperatures between 65-80ºF (18-27ºC) are ideal, and no lower than 60ºF (15ºC). Avoid cold drafts from near windows and doors.",39.97,4.0,18.96,"Brunei, Cambodia, Indonesia, Laos, Malaysia, Myanmar, Philippines, Singapore, Thailand, East Timor, Vietnam, American Samoa, Australia, Christmas Island, Cocos (Keeling) Islands, Cook Islands, Fiji, French Polynesia, Guam, Heard Island and McDonald Islands, Kiribati, Marshall Islands, Federated States of Micronesia, Nauru, New Caledonia, New Zealand, Niue, Norfolk Island, Northern Mariana Islands, Palau, Papua New Guinea, Pitcairn Islands, Samoa, Solomon Islands, Tokelau, Tonga, Tuvalu, United States Minor Outlying Islands, Vanuatu, Wallis and Futuna"
51,South America,"Heart of Jesus, angel wings, elephant ear, fancy leafed caladium", Caladium bicolor or Caladium hortulanum and others,Height 25in (60cm).,Toxic to cats and dogs.,https://www.houseplantsexpert.com/assets/images/caladium1.jpg,"Above 70ºF (21ºC) is the best temperature to provide, and no lower than 60ºF (15ºC).",39.9,10.0,26.33,"Argentina, Bolivia, Bouvet Island, Brazil, Chile, Colombia, Ecuador, Falkland Islands (Malvinas), French Guiana, Guyana, Paraguay, Peru, South Georgia and the South Sandwich Islands, Suriname, Uruguay, Venezuela"
52,Australia,"Kentia, paradise, thatch", Howea forsteriana,Height 10ft.,Non-toxic to cats and dogs.,https://www.houseplantsexpert.com/image-files/kentia-palm-houseplant.jpg,"Room temperatures of around 65f / 16c --- 75f / 24c are ideal.
The temperature should not become lower than 55f / 12.7c.",69.99,29.99,54.18,Australia
53,Africa,Lucky Bamboo,"  Dracaena Braunii, or Dracaena Sanderiana",Height 3ft. ,Not known.,https://www.houseplantsexpert.com/image-files/lucky-bamboo.jpg, Warm room temperature's and above are advised 65F (18C) - 90F (32C). Avoid lower than 55F/12C in the winter.,69.99,8.99,30.59,"Algeria, Angola, Benin, Botswana, British Indian Ocean Territory, Burkina Faso, Burundi, Cape Verde, Cameroon, Central African Republic, Chad, Comoros, Congo, Ivory Coast, Democratic Republic of the Congo, Djibouti, Egypt, Equatorial Guinea, Eritrea, Eswatini, Ethiopia, French Southern Territories, Gabon, Gambia, Ghana, Guinea, Guinea-Bissau, Kenya, Lesotho, Liberia, Libya, Madagascar, Malawi, Mali, Mauritania, Mauritius, Mayotte, Morocco, Mozambique, Namibia, Niger, Nigeria, Réunion, Rwanda, Saint Helena, Sao Tome and Principe, Senegal, Seychelles, Sierra Leone, Somalia, South Africa, South Sudan, Sudan, Togo, Tunisia, Uganda, United Republic of Tanzania, Western Sahara, Zambia, Zimbabwe"
54,Madagascar,Dragon Tree, Dracaena marginata,Height 8ft. ,Toxic to cats and dogs.,https://www.houseplantsexpert.com/image-files/Dracaena-marginata.jpg,"Average room temperatures are ideal between 65- 75F (18- 24 C) or more. They will live through much colder temperatures during winter (as I have observed), but keeping them in optimal health requires the room to be no less than 50F (10C).",54.99,10.0,29.06,Madagascar
55,South America,Delta Maidenhair Nest Fern,  Adiantum Raddianum,Height 1.5ft. ,Not known.,https://www.houseplantsexpert.com/assets/images/maidenhairfern.jpg,The ideal temperature to provide is between 65-75ºF (18-24ºC) for this plant. The minimum is 55ºF (13ºC).,32.99,5.99,15.98,"Argentina, Bolivia, Bouvet Island, Brazil, Chile, Colombia, Ecuador, Falkland Islands (Malvinas), French Guiana, Guyana, Paraguay, Peru, South Georgia and the South Sandwich Islands, Suriname, Uruguay, Venezuela"
56,"South America, Central America","Mexican fortune tree, money tree plant and others",  Pachira Aquatica,10ft tall.,Non-toxic to cats and dogs.,https://www.houseplantsexpert.com/image-files/pachira_money_tree.jpg,"Room temperatures from 65-75ºF (18-24ºC) are suitable, and no lower than 50ºF (10ºC).",104.99,14.47,38.03,"Argentina, Bolivia, Bouvet Island, Brazil, Chile, Colombia, Ecuador, Falkland Islands (Malvinas), French Guiana, Guyana, Paraguay, Peru, South Georgia and the South Sandwich Islands, Suriname, Uruguay, Venezuela, Belize, Costa Rica, El Salvador, Guatemala, Honduras, Mexico, Nicaragua, Panama"
57,Mexico,"Parlor, Parlour palm", Chamaedorea elegans,Height 4 ft.,Non-toxic to cats and dogs.,https://www.houseplantsexpert.com/image-files/parlor-palm.jpg,Average warmth 65F (18C) and above is fine and no less than 50F (10C) at night.,30.0,7.99,19.06,Mexico
58,South-eastern Asia,"Pygmy date, Miniature date palm", Phoenix roebelenii,Height 6ft.,Non-toxic to cats and dogs.,https://www.houseplantsexpert.com/image-files/pygmy-date.JPG,"Room temperatures of around 65f / 16c --- 75f / 24c are ideal.
The temperature should not become lower than 50f / 10c during winter.",89.99,8.0,31.63,"Brunei, Cambodia, Indonesia, Laos, Malaysia, Myanmar, Philippines, Singapore, Thailand, East Timor, Vietnam"
59,Fiji,Rabbit's Foot Fern, Davallia Fejeensis,Height 1 - 2ft. ,"Non toxic for cats, dogs and horses.",https://www.houseplantsexpert.com/images/rabbits_foot_fern.jpg,Temperatures from 60-75ºF (15-24ºC) is advised. No lower than 55ºF (13ºC).,24.0,4.0,12.37,Fiji
60,Brazil,Rattlesnake Plant, Calathea Lancifolia and C Insignis," 30"" tall.",Non-toxic to cats and dogs.,https://www.houseplantsexpert.com/assets/images/calathea_lancifolia.jpg,Room temperatures that average 65-75ºF (18-24ºC) and no lower than 60ºF (15ºC). Avoid drafts and sudden temperature changes.,NaN,NaN,NaN,Brazil
61,Brazil ,Rose Painted Calathea, Calathea Roseopicta,Height 20in (50cm) or more. ,Non-toxic to cats and dogs.,https://www.houseplantsexpert.com/images/calathea_roseopicta_leaf.jpg,"Average room temperatures of 65-75ºF (18-24ºC) are suitable, and no lower than 60ºF (15ºC).
Sudden temperature drops and cold drafts should be avoided.",69.0,5.0,32.8,
62,"India, Nepal, Myanmar, China, Malaysia","Rubber plant or tree, rubber bush", Ficus elastica,Height 10ft (3m). ,Toxic to cats and dogs.,https://www.houseplantsexpert.com/assets/images/rubber_plant.jpg,"Average room temperatures of 60 - 75F (15 - 24C are fine. Avoid lower than 55F (12C), sudden temperature drops and cold drafts.",74.99,7.99,38.93,"India, Nepal, Myanmar, China, Malaysia"
63,Asia,Sago Palm, Cycas Revoluta,Height 2ft indoors.,Toxic to cats and dogs (see article).,https://www.houseplantsexpert.com/images/sago_palm.jpg,"Temperature: Average room temperatures of 65F (16C) --- 75F (24C) are suitable and
no lower than 55F (12.7C). ",35.0,12.0,22.38,"Afghanistan, Armenia, Azerbaijan, Bahrain, Bangladesh, Bhutan, Brunei, Cambodia, China, Hong Kong S.A.R, Macao S.A.R, Cyprus, North Korea, Georgia, India, Indonesia, Iran, Iraq, Israel, Japan, Jordan, Kazakhstan, Kuwait, Kyrgyzstan, Laos, Lebanon, Malaysia, Maldives, Mongolia, Myanmar, Nepal, Oman, Pakistan, Philippines, Qatar, South Korea, Saudi Arabia, Singapore, Sri Lanka, Palestine, Syria, Tajikistan, Thailand, East Timor, Turkey, Turkmenistan, United Arab Emirates, Uzbekistan, Vietnam, Yemen"
64,Australia,"Sentry, belmore sentry, and curly palm", Howea belmoreana,Height 10ft (much more in the wild). ,Non-toxic to cats and dogs.,https://www.houseplantsexpert.com/image-files/sentrypalm-plant.jpg,"Room temperatures of around 65f / 16c --- 75f / 24c are ideal.
The temperature should not decline lower than 55f / 12.7c.",NaN,NaN,NaN,Australia
65,Madagascar,"Song of India, Pleomele", Dracaena Reflexa,Height 3ft and more indoors. ,Toxic to cats and dogs.,https://www.houseplantsexpert.com/image-files/dracaena_reflexa.png,The ideal temperatures are between 60F (15C) - 80F (27C). Allowing temperatures to go below 55F/12C can harm the plant. Avoid having a plant sitting near cold drafts.,190.0,14.36,54.68,Madagascar
66,Southern Africa,Spider or airplane, Chlorophytum comosum vittatum and variegatum,Height 60 cm - leaves 45 cm.,Non-toxic to cats and dogs.,https://www.houseplantsexpert.com/image-files/spiderplant_2.jpg, Minimum temperature should be no lower than 45F (7C). Ideal is approximately 60 - 75F (15 - 24C).,NaN,NaN,NaN,"Botswana, Eswatini, Lesotho, Namibia, South Africa"
67,"Mexico, Central America, Columbia",Swiss cheese or just cheese plant,  Monstera Deliciosa,Height over 10 ft tall.,Non-toxic to cats and dogs.,https://www.houseplantsexpert.com/assets/images/swiss_cheese_plant_flower.jpg,Temperatures between 65-80ºF (18-27ºC) are ideal. Lower than 65ºF (18Cº) will slow down this plants growth and below 50ºF (10ºC) will stop growth.,149.99,10.8,44.64,"Mexico, Belize, Costa Rica, El Salvador, Guatemala, Honduras, Mexico, Nicaragua, Panama"
68,China,"Umbrella Plant, Queensland Umbrella Tree, Octupus Tree, Gold Capella"," Schefflera Arboricolum, Syn Heptapleurum Arboricolum",Height 10ft tall or more. ,Toxic to cats and dogs.,https://www.houseplantsexpert.com/image-files/umbrella_plant.jpg,Grows well in average room temperatures between 60 - 75 F (15 - 24C) but no lower than 55F (13C) or higher than 75F (24C). Avoid sudden temperature drops and cold drafts.,179.0,10.99,44.41,China
69,United States of America,Venus fly trap,  Dionaea Muscipula,3 - 10 cm long stems.,Non-toxic to cats and dogs.,https://www.houseplantsexpert.com/image-files/venus-fly-trap.jpg,"These plants are happiest between 60- 90F (15- 32C) for most of the year. During the winter months, they enter a dormancy period, and can withstand temperatures as low as 30F (-1C) for short periods of time.",44.44,4.0,16.9,United States of America
70,South America,"Wandering Jew, Flowering Inch Plant"," Tradescantia Zebrina, Tradescantia Fluminensis [Syn T Albiflora] ",Stems grow over 2ft long.,Non-toxic to cats and toxic to dogs.,https://www.houseplantsexpert.com/images/wandering_jew2.jpg,"Average indoor temperatures of 65-75ºF (18-24ºC) are suitable, and no lower than 50ºF (10ºC).",18.99,3.99,11.97,"Argentina, Bolivia, Bouvet Island, Brazil, Chile, Colombia, Ecuador, Falkland Islands (Malvinas), French Guiana, Guyana, Paraguay, Peru, South Georgia and the South Sandwich Islands, Suriname, Uruguay, Venezuela"
71,"South-eastern Asia, Australia",Weeping Fig, Ficus Benjamina,Height up-to 10ft and miniature grown types 3ft.,Toxic to cats and dogs.,https://www.houseplantsexpert.com/image-files/ficus-benjamina.jpg,"Room temperatures of around 65f / 16c --- 75f / 24c is ideal.
Try not to allow temperatures to decrease lower than 50f / 10c, although they can handle a bit lower, without problems.",124.99,7.99,45.72,"Brunei, Cambodia, Indonesia, Laos, Malaysia, Myanmar, Philippines, Singapore, Thailand, East Timor, Vietnam, Australia"
72,Brazil,Zebra plant, Aphelandra squarrosa,Height 2ft. ,Non-toxic to cats and dogs.,https://www.houseplantsexpert.com/image-files/zebra_plant_1.png,Temperatures from 60-75 ºF (15-23 ºC) are ideal and no lower than 55 ºF (13 ºC).,39.99,12.75,21.37,Brazil
73,Mexico,Zebra plant, Calathea zebrina,Height 1m. ,Non-toxic to cats and dogs.,https://www.houseplantsexpert.com/images/zebrina.jpg,"Average room temperatures of 65-75ºF (18-24ºC) are best, and no lower than 60ºF (15ºC). Sudden temperature drops and cold drafts should be avoided.",69.0,15.0,33.3,Mexico
74,Africa,ZZ plant, Zamioculcas zamiifolia,Stems length 3ft (30 cm). ,Toxic to cats and dogs.,https://www.houseplantsexpert.com/image-files/zz_plant.png,Average warmth is fine of approximately 60-75F (15-24C) and no lower than 45F (8C).,160.0,6.0,62.23,"Algeria, Angola, Benin, Botswana, British Indian Ocean Territory, Burkina Faso, Burundi, Cape Verde, Cameroon, Central African Republic, Chad, Comoros, Congo, Ivory Coast, Democratic Republic of the Congo, Djibouti, Egypt, Equatorial Guinea, Eritrea, Eswatini, Ethiopia, French Southern Territories, Gabon, Gambia, Ghana, Guinea, Guinea-Bissau, Kenya, Lesotho, Liberia, Libya, Madagascar, Malawi, Mali, Mauritania, Mauritius, Mayotte, Morocco, Mozambique, Namibia, Niger, Nigeria, Réunion, Rwanda, Saint Helena, Sao Tome and Principe, Senegal, Seychelles, Sierra Leone, Somalia, South Africa, South Sudan, Sudan, Togo, Tunisia, Uganda, United Republic of Tanzania, Western Sahara, Zambia, Zimbabwe"
75,Northern Africa,"Aloe V, Medicine Plant, True Aloe, Burn Plant,","  Aloe V, Aloe barbadensis",Height 1 - 2 ft .,Toxic for cats and dogs.,assets/images/aloe-plant-near-window-1.jpg,Temperatures averaging 70F/21C - 80F/26C are very good and not much below 50F/10C.,12.56,2.99,8.17,"Algeria, Egypt, Libya, Morocco, Sudan, Tunisia, Western Sahara"
76,Africa,Not known, Argyroderma testiculare,Height 5cm - 15cm max.,"Not known, but it's unlikely a pet will chew on this type of foliage, although they could be curious and might want to plan with them..",https://www.houseplantsexpert.com/assets/images/argyroderma_testiculare.jpg,"Due to where the Argyroderma testiculare originated from it can comfortably handle temperatures of up to 85F (30C), however, it is not frost resistant and will need to be protected from cold weather (Min 50F - 10C) .
",34.99,2.84,10.62,"Algeria, Angola, Benin, Botswana, British Indian Ocean Territory, Burkina Faso, Burundi, Cape Verde, Cameroon, Central African Republic, Chad, Comoros, Congo, Ivory Coast, Democratic Republic of the Congo, Djibouti, Egypt, Equatorial Guinea, Eritrea, Eswatini, Ethiopia, French Southern Territories, Gabon, Gambia, Ghana, Guinea, Guinea-Bissau, Kenya, Lesotho, Liberia, Libya, Madagascar, Malawi, Mali, Mauritania, Mauritius, Mayotte, Morocco, Mozambique, Namibia, Niger, Nigeria, Réunion, Rwanda, Saint Helena, Sao Tome and Principe, Senegal, Seychelles, Sierra Leone, Somalia, South Africa, South Sudan, Sudan, Togo, Tunisia, Uganda, United Republic of Tanzania, Western Sahara, Zambia, Zimbabwe"
77,South America,"Baby rubber plant, American rubber plant, Pepper face plant", Peperomia obtusifolia,25 - 30 cm tall.,Non-toxic to cats and dogs.,https://www.houseplantsexpert.com/assets/images/american_baby_rubber_plant.jpg,"Ideal temperatures of 65-75ºF (18-24ºC), and no lower than 50ºF (10ºC).",129.0,3.5,33.17,"Argentina, Bolivia, Bouvet Island, Brazil, Chile, Colombia, Ecuador, Falkland Islands (Malvinas), French Guiana, Guyana, Paraguay, Peru, South Georgia and the South Sandwich Islands, Suriname, Uruguay, Venezuela"
78,Mexico,Bunny ear and polka-dot cactus, Opuntia Microdasys,Height 12 - 18in/30.5 - 45.5cm.,"The fruit and flowers are non-toxic to pets, but the glochids are moderately irritating to the skin.",https://www.houseplantsexpert.com/image-files/close-up-of-glochids-opuntia-microdasys.jpg,"This cactus enjoys temperatures ranging from 70-100F (21-37C), but demands cooler temperatures during the winter months.
Starting in the late fall, this cactus should be kept between 50-65F (10-18C), and away from central heating vents. The cooler spell is
demanded over the course of the entire winter, during which time the segments of cactus will turn a light gray color. Failure to provide
these controlled winter conditions will result in plant death the following spring.",46.13,5.49,12.95,Mexico
79,South America,"Century plant, Agave cactus, Maguey, American aloe", Agave americana,Height 1m - 1.5m.,Toxic for cats and dogs.,https://www.houseplantsexpert.com/assets/images/century_plant.jpg,The plant thrives in warm temperatures during the summer although the winter months can prove troublesome should the temperature fall below 10C. It handles changes in day and night time temperatures very well. Temperatures averaging 70F/21C - 80F/26C are very good and not much below 50F/10C. ,66.5,10.0,23.84,"Argentina, Bolivia, Bouvet Island, Brazil, Chile, Colombia, Ecuador, Falkland Islands (Malvinas), French Guiana, Guyana, Paraguay, Peru, South Georgia and the South Sandwich Islands, Suriname, Uruguay, Venezuela"
80,Brazil,Christmas and holiday cactus," Schlumbergera Bridgesii, S × buckleyi","Height 10 in/25.4 cm, diameter 24 in/61 cm.",Non-Toxic to cats and dogs.,https://www.houseplantsexpert.com/image-files/christmas-cactus.jpg,"This cactus requires a resting period that helps it to bloom again, from Feb - March. During this time keep temperatures at approximately 55F (12.7C) and water less. Pre - flowering period from Oct - Nov requires the plant soil to be kept fairly dry until flowers bud, and then resume normal watering and temperatures.",NaN,NaN,NaN,Brazil
81,Mexico,"Christmas cheer, Pork and beans", Sedum rubrotinctum,Height upto 1 ft (30 cm).,Mildly toxic for cats and dogs.,https://www.houseplantsexpert.com/assets/images/sedum_rubrotinctum.jpg,"It is more suited to hotter climates and this means that temperatures below freezing will damage the plants. Moving the plant indoors during cold snaps will help to maintain its growth and health, especially if placed on a windowsill that is western or southern facing. N
No lower than 50 F (10F) - 55F (12.7C) is best and during summer between 65F (18C) - 75F - (23.8C+).
",12.99,3.94,8.69,Mexico
82,Africa,Coral cactus, Eurphorbia lactea crest,Height 9 in - 15 in.,Toxic to cats and dogs (see description).,https://www.houseplantsexpert.com/image-files/coral-cactus-orig.jpg,"The Coral likes it's sunshine and warm conditions which help it to grow and maintain's it's health.
A partially sunny spot and average temperatures of no lower than approximately 60F (15C) will suffice.",50.0,23.99,36.6,"Algeria, Angola, Benin, Botswana, British Indian Ocean Territory, Burkina Faso, Burundi, Cape Verde, Cameroon, Central African Republic, Chad, Comoros, Congo, Ivory Coast, Democratic Republic of the Congo, Djibouti, Egypt, Equatorial Guinea, Eritrea, Eswatini, Ethiopia, French Southern Territories, Gabon, Gambia, Ghana, Guinea, Guinea-Bissau, Kenya, Lesotho, Liberia, Libya, Madagascar, Malawi, Mali, Mauritania, Mauritius, Mayotte, Morocco, Mozambique, Namibia, Niger, Nigeria, Réunion, Rwanda, Saint Helena, Sao Tome and Principe, Senegal, Seychelles, Sierra Leone, Somalia, South Africa, South Sudan, Sudan, Togo, Tunisia, Uganda, United Republic of Tanzania, Western Sahara, Zambia, Zimbabwe"
83,Mexico,Donkey's and Burros Tail, Sedum Morganianum,Stems trail from 1 - 3 ft long .,Non-toxic to cats and dogs.,https://www.houseplantsexpert.com/assets/images/donkeys_tail_sedum.jpg,Temperatures averaging 65F/18C - 80F/26C are very good and not much below 50F/10C. During winter it is fine if the temperature drops down and it can encourage them to actually bloom in the forthcoming spring season.,17.76,3.99,13.68,Mexico
84,Brazil,Easter or holiday cactus, Hatiora Gaertneri,Height 25 in/63 cm.,Non-Toxic to cats and dogs.,https://www.houseplantsexpert.com/image-files/Hatiora-gaertneri.jpg,"Temperature: The tropical Hatiora gaertneri prefers spring, summer, and fall temperatures around 75-80F (24-27C). Winter temperatures should be between 45-65F (7-18C) only.",30.0,8.5,19.2,Brazil
85,Western Sahara,"Housetree Leek, Black Rose Tree", Aeonium Arboreum - var Atropurpureum and Zwartkop/Schwarzkopf,Max 3ft tall.,Not known.,https://www.houseplantsexpert.com/assets/images/aeonium_arboreum_zwartkop.jpg,Temperatures averaging 70F/21C - 85F/29.4C. Avoid below 50F/10C. During summer this species will appreciate being taken outside and then brought back in when colder weather sets in.,NaN,NaN,NaN,Western Sahara
86,Madagascar,Flaming katy,  Kalanchoe blossfeldiana,18 inches in height.,Toxic to cats and dogs.,https://www.houseplantsexpert.com/image-files/flaming-katy-plants-potted.jpg,"Average room temperatures from 65F/18.3C - 75F/23.8C and no lower than 50F/10C, is best; avoiding frost if they are grown or sitting outside for a period of time.",33.9,4.99,12.67,Madagascar
87,Mexico,Goat's horn cactus, Astrophytum Capricorne,"Height 18 in/45 cm, diameter 10 in/25 cm.",Not known.,https://www.houseplantsexpert.com/image-files/goats-horn-cactus-flowering.jpg,"Average temperatures between 60-80F (15-21C) from spring until fall, and between 50-55F (10-12C) during winter. ",75.0,8.99,22.01,Mexico
88,Mexico,"Golden barrel cactus , golden ball cactus, mother-in-law's cushion",  Echinocactus Grusonii,Height 60in (24cm). Diameter 36in (91cm).,Not known.,https://www.houseplantsexpert.com/image-files/Golden_Barrel_Cactus.jpg,Temperatures averaging 50F/10C - 75F/23.8C are ideal but not below 40F/5C and avoid frost.,365.0,6.99,85.89,Mexico
89,Southern Africa,"Jade, money , lucky, friendship"," Crassula Ovata, Cportulacea, Cargentea","Height = 3ft or much less, as a bonsai.",Toxic to cats and dogs.,https://www.houseplantsexpert.com/image-files/jade-plant.jpg,Room temperatures of around 60f / 15.5c --- 75f / 24c are ideal. Winter no less than 50f / 10c.,NaN,NaN,NaN,"Botswana, Eswatini, Lesotho, Namibia, South Africa"
90,Mexico,"Jelly beans, Many fingers", Sedum pachyphyllum,Height upto 1 ft (30 cm).,Mildly toxic for cats and dogs.,https://www.houseplantsexpert.com/assets/images/jelly_beans_plant.jpg,"Cool temperatures in the winter no lower than 50 F (10F) - 55F (12.7C) is best and during summer between 65F (18C) - 75F - (23.8C+).
The Sedum Pachyphyllum does tend to grow well in hotter conditions but it is important to remember that it should not be kept outside when the temperature drops to freezing. It should then be moved indoors and should be positioned by a western or southern facing window.",26.0,2.99,13.4,Mexico
